{
  "schema_version": 1,
  "source": "wenyou_rules_default",
  "rarity_rates": {
    "D": [
      { "rarity": "D", "weight": 70 },
      { "rarity": "C", "weight": 25 },
      { "rarity": "B", "weight": 5 }
    ],
    "C": [
      { "rarity": "D", "weight": 20 },
      { "rarity": "C", "weight": 60 },
      { "rarity": "B", "weight": 18 },
      { "rarity": "A", "weight": 2 }
    ],
    "B": [
      { "rarity": "C", "weight": 25 },
      { "rarity": "B", "weight": 55 },
      { "rarity": "A", "weight": 18 },
      { "rarity": "S", "weight": 2 }
    ],
    "A": [
      { "rarity": "B", "weight": 35 },
      { "rarity": "A", "weight": 55 },
      { "rarity": "S", "weight": 10 }
    ],
    "S": [
      { "rarity": "A", "weight": 45 },
      { "rarity": "S", "weight": 55 }
    ]
  },
  "category_rates": {
    "D": [
      { "category": "consumable_item", "weight": 56 },
      { "category": "material", "weight": 24 },
      { "category": "tool_item", "weight": 18 },
      { "category": "special", "weight": 2 }
    ],
    "C": [
      { "category": "consumable_item", "weight": 40 },
      { "category": "material", "weight": 25 },
      { "category": "tool_item", "weight": 30 },
      { "category": "special", "weight": 5 }
    ],
    "B": [
      { "category": "consumable_item", "weight": 24 },
      { "category": "material", "weight": 26 },
      { "category": "tool_item", "weight": 38 },
      { "category": "special", "weight": 12 }
    ],
    "A": [
      { "category": "consumable_item", "weight": 14 },
      { "category": "material", "weight": 24 },
      { "category": "tool_item", "weight": 42 },
      { "category": "special", "weight": 20 }
    ],
    "S": [
      { "category": "consumable_item", "weight": 8 },
      { "category": "material", "weight": 18 },
      { "category": "tool_item", "weight": 44 },
      { "category": "special", "weight": 30 }
    ]
  },
  "tag_category_boosts": {
    "monster_sealed": { "special": 8, "tool_item": 3 },
    "monster_defeated": { "tool_item": 8, "material": 5 },
    "monster_evaded": { "consumable_item": 5, "tool_item": 3 },
    "hidden": { "special": 8, "tool_item": 4 }
  }
}
